{
  "kind": "tenant_overlay",
  "schemaVersion": "1.0",
  "tenantId": "tenant-a",
  "appId": "memberdesk",
  "appVersion": "7.4",
  "baseUrl": "http://localhost:4000",
  "textMap": {},
  "patches": [],
  "disabledCapabilities": [],
  "secrets": {
    "operatorId": { "env": "MEMBERDESK_OPERATOR_ID" },
    "operatorPassword": { "env": "MEMBERDESK_OPERATOR_PASSWORD" }
  }
}
